{
  "baselineId": "baseline-v2.6.1-v0.5.1",
  "changedCapabilities": [],
  "handoffIds": [],
  "id": "assessment-161-e3d94e5",
  "outcome": "pending",
  "rationale": "",
  "review": {
    "status": "pending"
  },
  "schemaVersion": "1.0.0",
  "sourcePr": {
    "baseBranch": "develop",
    "mergeCommitSha": "e3d94e519d07bc7d43272c0de1e576520cda3258",
    "mergedAt": "2026-09-18T17:58:46Z",
    "number": 161,
    "repository": "Azure/bicep-ptn-aiml-landing-zone",
    "url": "https://github.com/Azure/bicep-ptn-aiml-landing-zone/pull/161"
  }
}
