{
  "baselineId": "baseline-v2.6.1-v0.5.1",
  "changedCapabilities": [],
  "handoffIds": [],
  "id": "assessment-171-ffd4e52",
  "outcome": "pending",
  "rationale": "",
  "review": {
    "status": "pending"
  },
  "schemaVersion": "1.0.0",
  "sourcePr": {
    "baseBranch": "develop",
    "mergeCommitSha": "ffd4e520fb1cfc3d6a991d9e63cd825782d3525f",
    "mergedAt": "2026-09-20T21:35:50Z",
    "number": 171,
    "repository": "Azure/bicep-ptn-aiml-landing-zone",
    "url": "https://github.com/Azure/bicep-ptn-aiml-landing-zone/pull/171"
  }
}
